{
  "scene_id": "indoor_room_real_003",
  "file_path": "indoor_room_real.ply",
  "source_type": "ply",
  "metadata_path": "real_scene_metadata.json",
  "expected_unit": "meter",
  "scale_hint": "meter_scale_likely",
  "output_dir": "../../outputs/runs/multi_scene_real/indoor_room_real_003",
  "normalize_scene": true,
  "calibration_mode": "v1",
  "generator_mode": "mock",
  "spatiallm_command": null,
  "spatiallm_output_json": null,
  "external_timeout_sec": 120,
  "spatiallm_command_env_var": "SCSLM_SPATIALLM_COMMAND",
  "spatiallm_export_format": "json",
  "compare_with_external_generator": false
}
